{
 "games": {
  "2021|10|ARI|CAR": 0.7445,
  "2021|10|DAL|ATL": 0.7732,
  "2021|10|DEN|PHI": 0.5139,
  "2021|10|GB|SEA": 0.6114,
  "2021|10|IND|JAX": 0.7882,
  "2021|10|LAC|MIN": 0.6252,
  "2021|10|LV|KC": 0.419,
  "2021|10|MIA|BAL": 0.2278,
  "2021|10|NE|CLE": 0.5548,
  "2021|10|NYJ|BUF": 0.1545,
  "2021|10|PIT|DET": 0.7592,
  "2021|10|SF|LAR": 0.3776,
  "2021|10|TEN|NO": 0.581,
  "2021|10|WAS|TB": 0.2113,
  "2021|11|ATL|NE": 0.2555,
  "2021|11|BUF|IND": 0.7402,
  "2021|11|CAR|WAS": 0.6163,
  "2021|11|CHI|BAL": 0.3254,
  "2021|11|CLE|DET": 0.8285,
  "2021|11|JAX|SF": 0.2833,
  "2021|11|KC|DAL": 0.5597,
  "2021|11|LAC|PIT": 0.6959,
  "2021|11|LV|CIN": 0.461,
  "2021|11|MIN|GB": 0.4861,
  "2021|11|NYJ|MIA": 0.3721,
  "2021|11|PHI|NO": 0.5758,
  "2021|11|SEA|ARI": 0.5851,
  "2021|11|TB|NYG": 0.8147,
  "2021|11|TEN|HOU": 0.7968,
  "2021|12|BAL|CLE": 0.5939,
  "2021|12|CIN|PIT": 0.6163,
  "2021|12|DAL|LV": 0.7368,
  "2021|12|DEN|LAC": 0.4295,
  "2021|12|DET|CHI": 0.4523,
  "2021|12|GB|LAR": 0.4685,
  "2021|12|HOU|NYJ": 0.5661,
  "2021|12|IND|TB": 0.4156,
  "2021|12|JAX|ATL": 0.477,
  "2021|12|MIA|CAR": 0.4694,
  "2021|12|NE|TEN": 0.7316,
  "2021|12|NO|BUF": 0.2903,
  "2021|12|NYG|PHI": 0.3595,
  "2021|12|SF|MIN": 0.6306,
  "2021|12|WAS|SEA": 0.452,
  "2021|13|ATL|TB": 0.1991,
  "2021|13|BUF|NE": 0.5793,
  "2021|13|CHI|ARI": 0.2345,
  "2021|13|CIN|LAC": 0.5705,
  "2021|13|DET|MIN": 0.2737,
  "2021|13|HOU|IND": 0.221,
  "2021|13|KC|DEN": 0.7707,
  "2021|13|LAR|JAX": 0.861,
  "2021|13|LV|WAS": 0.548,
  "2021|13|MIA|NYG": 0.7247,
  "2021|13|NO|DAL": 0.3021,
  "2021|13|NYJ|PHI": 0.3517,
  "2021|13|PIT|BAL": 0.3557,
  "2021|13|SEA|SF": 0.4339,
  "2021|14|ARI|LAR": 0.6163,
  "2021|14|CAR|ATL": 0.5624,
  "2021|14|CIN|SF": 0.4491,
  "2021|14|CLE|BAL": 0.5851,
  "2021|14|DEN|DET": 0.8371,
  "2021|14|GB|CHI": 0.8379,
  "2021|14|HOU|SEA": 0.2235,
  "2021|14|KC|LV": 0.7915,
  "2021|14|LAC|NYG": 0.7739,
  "2021|14|MIN|PIT": 0.6206,
  "2021|14|NYJ|NO": 0.357,
  "2021|14|TB|BUF": 0.627,
  "2021|14|TEN|JAX": 0.7696,
  "2021|14|WAS|DAL": 0.281,
  "2021|15|BAL|GB": 0.2432,
  "2021|15|BUF|CAR": 0.8536,
  "2021|15|CHI|MIN": 0.2598,
  "2021|15|CLE|LV": 0.4211,
  "2021|15|DEN|CIN": 0.5933,
  "2021|15|DET|ARI": 0.1629,
  "2021|15|IND|NE": 0.5081,
  "2021|15|JAX|HOU": 0.6999,
  "2021|15|LAC|KC": 0.3823,
  "2021|15|LAR|SEA": 0.7561,
  "2021|15|MIA|NYJ": 0.7919,
  "2021|15|NYG|DAL": 0.1836,
  "2021|15|PHI|WAS": 0.798,
  "2021|15|PIT|TEN": 0.5336,
  "2021|15|SF|ATL": 0.7684,
  "2021|15|TB|NO": 0.8125,
  "2021|16|ARI|IND": 0.5998,
  "2021|16|ATL|DET": 0.7633,
  "2021|16|CAR|TB": 0.1937,
  "2021|16|CIN|BAL": 0.7616,
  "2021|16|DAL|WAS": 0.793,
  "2021|16|GB|CLE": 0.7823,
  "2021|16|HOU|LAC": 0.161,
  "2021|16|KC|PIT": 0.774,
  "2021|16|LV|DEN": 0.4919,
  "2021|16|MIN|LAR": 0.3776,
  "2021|16|NE|BUF": 0.5183,
  "2021|16|NO|MIA": 0.4007,
  "2021|16|NYJ|JAX": 0.5431,
  "2021|16|PHI|NYG": 0.8127,
  "2021|16|SEA|CHI": 0.7361,
  "2021|16|TEN|SF": 0.3842,
  "2021|17|BAL|LAR": 0.2661,
  "2021|17|BUF|ATL": 0.8667,
  "2021|17|CHI|NYG": 0.719,
  "2021|17|CIN|KC": 0.378,
  "2021|17|DAL|ARI": 0.7017,
  "2021|17|GB|MIN": 0.8455,
  "2021|17|IND|LV": 0.7725,
  "2021|17|LAC|DEN": 0.7484,
  "2021|17|NE|JAX": 0.8831,
  "2021|17|NO|CAR": 0.7133,
  "2021|17|NYJ|TB": 0.1336,
  "2021|17|PIT|CLE": 0.475,
  "2021|17|SEA|DET": 0.7735,
  "2021|17|SF|HOU": 0.8284,
  "2021|17|TEN|MIA": 0.6125,
  "2021|17|WAS|PHI": 0.317,
  "2021|18|ARI|SEA": 0.6704,
  "2021|18|ATL|NO": 0.3394,
  "2021|18|BAL|PIT": 0.5882,
  "2021|18|BUF|NYJ": 0.8873,
  "2021|18|CLE|CIN": 0.6958,
  "2021|18|DEN|KC": 0.179,
  "2021|18|DET|GB": 0.3634,
  "2021|18|HOU|TEN": 0.1871,
  "2021|18|JAX|IND": 0.1279,
  "2021|18|LAR|SF": 0.6115,
  "2021|18|LV|LAC": 0.3789,
  "2021|18|MIA|NE": 0.3182,
  "2021|18|MIN|CHI": 0.6301,
  "2021|18|NYG|WAS": 0.317,
  "2021|18|PHI|DAL": 0.2847,
  "2021|18|TB|CAR": 0.7988,
  "2021|1|ATL|PHI": 0.6266,
  "2021|1|BUF|PIT": 0.7072,
  "2021|1|CAR|NYJ": 0.6311,
  "2021|1|CIN|MIN": 0.4395,
  "2021|1|DET|SF": 0.2184,
  "2021|1|HOU|JAX": 0.3837,
  "2021|1|IND|SEA": 0.4207,
  "2021|1|KC|CLE": 0.6873,
  "2021|1|LAR|CHI": 0.7711,
  "2021|1|LV|BAL": 0.391,
  "2021|1|NE|MIA": 0.6177,
  "2021|1|NO|GB": 0.3721,
  "2021|1|NYG|DEN": 0.4332,
  "2021|1|TB|DAL": 0.785,
  "2021|1|TEN|ARI": 0.5782,
  "2021|1|WAS|LAC": 0.55,
  "2021|2|ARI|MIN": 0.6393,
  "2021|2|BAL|KC": 0.3851,
  "2021|2|CAR|NO": 0.4225,
  "2021|2|CHI|CIN": 0.544,
  "2021|2|CLE|HOU": 0.844,
  "2021|2|GB|DET": 0.8061,
  "2021|2|IND|LAR": 0.3454,
  "2021|2|JAX|DEN": 0.3127,
  "2021|2|LAC|DAL": 0.5851,
  "2021|2|MIA|BUF": 0.3748,
  "2021|2|NYJ|NE": 0.3171,
  "2021|2|PHI|SF": 0.4242,
  "2021|2|PIT|LV": 0.6766,
  "2021|2|SEA|TEN": 0.72,
  "2021|2|TB|ATL": 0.8579,
  "2021|2|WAS|NYG": 0.6471,
  "2021|3|BUF|WAS": 0.7452,
  "2021|3|CLE|CHI": 0.7662,
  "2021|3|DAL|PHI": 0.6367,
  "2021|3|DEN|NYJ": 0.83,
  "2021|3|DET|BAL": 0.2477,
  "2021|3|HOU|CAR": 0.2165,
  "2021|3|JAX|ARI": 0.2403,
  "2021|3|KC|LAC": 0.7115,
  "2021|3|LAR|TB": 0.4977,
  "2021|3|LV|MIA": 0.643,
  "2021|3|MIN|SEA": 0.4673,
  "2021|3|NE|NO": 0.5758,
  "2021|3|NYG|ATL": 0.574,
  "2021|3|PIT|CIN": 0.5687,
  "2021|3|SF|GB": 0.6252,
  "2021|3|TEN|IND": 0.6455,
  "2021|4|ATL|WAS": 0.4738,
  "2021|4|BUF|HOU": 0.9107,
  "2021|4|CHI|DET": 0.5827,
  "2021|4|CIN|JAX": 0.7651,
  "2021|4|DAL|CAR": 0.6596,
  "2021|4|DEN|BAL": 0.5284,
  "2021|4|GB|PIT": 0.7133,
  "2021|4|LAC|LV": 0.6008,
  "2021|4|LAR|ARI": 0.6495,
  "2021|4|MIA|IND": 0.5758,
  "2021|4|MIN|CLE": 0.5012,
  "2021|4|NE|TB": 0.3012,
  "2021|4|NO|NYG": 0.7485,
  "2021|4|NYJ|TEN": 0.3181,
  "2021|4|PHI|KC": 0.2452,
  "2021|4|SF|SEA": 0.5567,
  "2021|5|ARI|SF": 0.7064,
  "2021|5|ATL|NYJ": 0.59,
  "2021|5|BAL|IND": 0.7579,
  "2021|5|CAR|PHI": 0.5679,
  "2021|5|CIN|GB": 0.4621,
  "2021|5|DAL|NYG": 0.7478,
  "2021|5|HOU|NE": 0.2502,
  "2021|5|JAX|TEN": 0.3607,
  "2021|5|KC|BUF": 0.5586,
  "2021|5|LAC|CLE": 0.55,
  "2021|5|LV|CHI": 0.6911,
  "2021|5|MIN|DET": 0.7826,
  "2021|5|PIT|DEN": 0.4589,
  "2021|5|SEA|LAR": 0.4395,
  "2021|5|TB|MIA": 0.8232,
  "2021|5|WAS|NO": 0.4491,
  "2021|6|BAL|LAC": 0.6084,
  "2021|6|CAR|MIN": 0.4414,
  "2021|6|CHI|GB": 0.3234,
  "2021|6|CLE|ARI": 0.574,
  "2021|6|DEN|LV": 0.6546,
  "2021|6|DET|CIN": 0.3595,
  "2021|6|IND|HOU": 0.7906,
  "2021|6|JAX|MIA": 0.4642,
  "2021|6|NE|DAL": 0.3624,
  "2021|6|NYG|LAR": 0.2556,
  "2021|6|PHI|TB": 0.2877,
  "2021|6|PIT|SEA": 0.6629,
  "2021|6|TEN|BUF": 0.3139,
  "2021|6|WAS|KC": 0.3012,
  "2021|7|ARI|HOU": 0.9202,
  "2021|7|BAL|CIN": 0.7107,
  "2021|7|CLE|DEN": 0.5348,
  "2021|7|GB|WAS": 0.7749,
  "2021|7|LAR|DET": 0.8989,
  "2021|7|LV|PHI": 0.507,
  "2021|7|MIA|ATL": 0.45,
  "2021|7|NE|NYJ": 0.7308,
  "2021|7|NYG|CAR": 0.4083,
  "2021|7|SEA|NO": 0.3159,
  "2021|7|SF|IND": 0.6129,
  "2021|7|TB|CHI": 0.8388,
  "2021|7|TEN|KC": 0.3416,
  "2021|8|ARI|GB": 0.7157,
  "2021|8|ATL|CAR": 0.55,
  "2021|8|BUF|MIA": 0.8801,
  "2021|8|CHI|SF": 0.3404,
  "2021|8|CLE|PIT": 0.6711,
  "2021|8|DEN|WAS": 0.6393,
  "2021|8|DET|PHI": 0.3886,
  "2021|8|HOU|LAR": 0.1177,
  "2021|8|IND|TEN": 0.6002,
  "2021|8|KC|NYG": 0.8154,
  "2021|8|LAC|NE": 0.6297,
  "2021|8|MIN|DAL": 0.6679,
  "2021|8|NO|TB": 0.3637,
  "2021|8|NYJ|CIN": 0.1897,
  "2021|8|SEA|JAX": 0.6405,
  "2021|9|BAL|MIN": 0.7316,
  "2021|9|CAR|NE": 0.379,
  "2021|9|CIN|CLE": 0.55,
  "2021|9|DAL|DEN": 0.7971,
  "2021|9|IND|NYJ": 0.81,
  "2021|9|JAX|BUF": 0.1107,
  "2021|9|KC|GB": 0.741,
  "2021|9|LAR|TEN": 0.7549,
  "2021|9|MIA|HOU": 0.6333,
  "2021|9|NO|ATL": 0.7141,
  "2021|9|NYG|LV": 0.4116,
  "2021|9|PHI|LAC": 0.4977,
  "2021|9|PIT|CHI": 0.7323,
  "2021|9|SF|ARI": 0.6829,
  "2022|10|BUF|MIN": 0.7053,
  "2022|10|CAR|ATL": 0.4452,
  "2022|10|CHI|DET": 0.5987,
  "2022|10|GB|DAL": 0.3517,
  "2022|10|KC|JAX": 0.7759,
  "2022|10|LAR|ARI": 0.627,
  "2022|10|LV|IND": 0.6483,
  "2022|10|MIA|CLE": 0.6224,
  "2022|10|NYG|HOU": 0.6701,
  "2022|10|PHI|WAS": 0.8081,
  "2022|10|PIT|NO": 0.524,
  "2022|10|SF|LAC": 0.7585,
  "2022|10|TB|SEA": 0.565,
  "2022|10|TEN|DEN": 0.5605,
  "2022|11|ARI|SF": 0.2156,
  "2022|11|ATL|CHI": 0.5661,
  "2022|11|BAL|CAR": 0.8393,
  "2022|11|BUF|CLE": 0.7562,
  "2022|11|DEN|LV": 0.5775,
  "2022|11|GB|TEN": 0.6149,
  "2022|11|HOU|WAS": 0.4149,
  "2022|11|IND|PHI": 0.2903,
  "2022|11|LAC|KC": 0.3211,
  "2022|11|MIN|DAL": 0.4472,
  "2022|11|NE|NYJ": 0.6293,
  "2022|11|NO|LAR": 0.5399,
  "2022|11|NYG|DET": 0.5987,
  "2022|11|PIT|CIN": 0.3707,
  "2022|12|ARI|LAC": 0.4376,
  "2022|12|CAR|DEN": 0.476,
  "2022|12|CLE|TB": 0.3881,
  "2022|12|DAL|NYG": 0.7905,
  "2022|12|DET|BUF": 0.2195,
  "2022|12|IND|PIT": 0.548,
  "2022|12|JAX|BAL": 0.3946,
  "2022|12|KC|LAR": 0.8883,
  "2022|12|MIA|HOU": 0.8641,
  "2022|12|MIN|NE": 0.5624,
  "2022|12|NYJ|CHI": 0.7662,
  "2022|12|PHI|GB": 0.7149,
  "2022|12|SEA|LV": 0.6447,
  "2022|12|SF|NO": 0.7728,
  "2022|12|TEN|CIN": 0.5,
  "2022|12|WAS|ATL": 0.6297,
  "2022|13|ATL|PIT": 0.4815,
  "2022|13|BAL|DEN": 0.7536,
  "2022|13|CHI|GB": 0.3707,
  "2022|13|CIN|KC": 0.4441,
  "2022|13|DAL|IND": 0.7963,
  "2022|13|DET|JAX": 0.5284,
  "2022|13|HOU|CLE": 0.2555,
  "2022|13|LAR|SEA": 0.2761,
  "2022|13|LV|LAC": 0.5668,
  "2022|13|MIN|NYJ": 0.5793,
  "2022|13|NE|BUF": 0.3676,
  "2022|13|NYG|WAS": 0.4589,
  "2022|13|PHI|TEN": 0.6629,
  "2022|13|SF|MIA": 0.6711,
  "2022|13|TB|NO": 0.638,
  "2022|14|ARI|NE": 0.458,
  "2022|14|BUF|NYJ": 0.7754,
  "2022|14|CIN|CLE": 0.6535,
  "2022|14|DAL|HOU": 0.9046,
  "2022|14|DEN|KC": 0.2262,
  "2022|14|DET|MIN": 0.5548,
  "2022|14|LAC|MIA": 0.3961,
  "2022|14|LAR|LV": 0.2818,
  "2022|14|NYG|PHI": 0.2699,
  "2022|14|PIT|BAL": 0.5399,
  "2022|14|SEA|CAR": 0.6495,
  "2022|14|SF|TB": 0.6455,
  "2022|14|TEN|JAX": 0.6119,
  "2022|15|BUF|MIA": 0.7397,
  "2022|15|CAR|PIT": 0.5765,
  "2022|15|CHI|PHI": 0.2294,
  "2022|15|CLE|BAL": 0.5923,
  "2022|15|DEN|ARI": 0.5348,
  "2022|15|GB|LAR": 0.7579,
  "2022|15|HOU|KC": 0.1442,
  "2022|15|JAX|DAL": 0.3637,
  "2022|15|LAC|TEN": 0.5971,
  "2022|15|LV|NE": 0.55,
  "2022|15|MIN|IND": 0.6363,
  "2022|15|NO|ATL": 0.6789,